{
  "generatedAt": "2026-02-12T00:00:00Z",
  "namespace": "tensor",
  "product": "core",
  "version": "0.20260212e",
  "schemaVersion": "0.20260212e",
  "locale": "en-US",
  "entryNodeIds": [
    "Q1",
    "Q2",
    "Q3",
    "Q4",
    "Q5",
    "Q6",
    "Q7"
  ],
  "nodes": [
    {
      "id": "Q1",
      "text": "Is there evidence that identity authentication and privilege activity was observed in control-plane actions during the investigation timeframe?",
      "label": "Identity: Evidence observed - Control-plane actions",
      "category": "Identity",
      "archetype": "detect"
    },
    {
      "id": "Q2",
      "text": "Is there evidence that endpoint execution and persistence activity was observed in transport metadata during the investigation timeframe?",
      "label": "Host: Evidence observed - Transport metadata",
      "category": "Host",
      "archetype": "detect"
    },
    {
      "id": "Q3",
      "text": "Is there evidence that network session and transport activity was observed in privileged access events during the investigation timeframe?",
      "label": "Network: Evidence observed - Privileged access events",
      "category": "Network",
      "archetype": "detect"
    },
    {
      "id": "Q4",
      "text": "Is there evidence that cloud control-plane and workload activity was observed in session anomalies during the investigation timeframe?",
      "label": "Cloud: Evidence observed - Session anomalies",
      "category": "Cloud",
      "archetype": "detect"
    },
    {
      "id": "Q5",
      "text": "Is there evidence that mailbox message and collaboration activity was observed in collaboration artifacts during the investigation timeframe?",
      "label": "Email: Evidence observed - Collaboration artifacts",
      "category": "Email",
      "archetype": "detect"
    },
    {
      "id": "Q6",
      "text": "Is there evidence that application request and session activity was observed in execution lineage during the investigation timeframe?",
      "label": "Application: Evidence observed - Execution lineage",
      "category": "Application",
      "archetype": "detect"
    },
    {
      "id": "Q7",
      "text": "Is there evidence that file artifact and content activity was observed in process ancestry during the investigation timeframe?",
      "label": "File: Evidence observed - Process ancestry",
      "category": "File",
      "archetype": "detect"
    },
    {
      "id": "Q8",
      "text": "Is identity authentication and privilege activity present in collected evidence related to content lineage?",
      "label": "Identity: Evidence present - Content lineage",
      "category": "Identity",
      "archetype": "detect"
    },
    {
      "id": "Q9",
      "text": "Is endpoint execution and persistence activity present in collected evidence related to control-plane actions?",
      "label": "Host: Evidence present - Control-plane actions",
      "category": "Host",
      "archetype": "detect"
    },
    {
      "id": "Q10",
      "text": "Is network session and transport activity present in collected evidence related to transport metadata?",
      "label": "Network: Evidence present - Transport metadata",
      "category": "Network",
      "archetype": "detect"
    },
    {
      "id": "Q11",
      "text": "Is cloud control-plane and workload activity present in collected evidence related to privileged access events?",
      "label": "Cloud: Evidence present - Privileged access events",
      "category": "Cloud",
      "archetype": "detect"
    },
    {
      "id": "Q12",
      "text": "Is mailbox message and collaboration activity present in collected evidence related to session anomalies?",
      "label": "Email: Evidence present - Session anomalies",
      "category": "Email",
      "archetype": "detect"
    },
    {
      "id": "Q13",
      "text": "Is application request and session activity present in collected evidence related to collaboration artifacts?",
      "label": "Application: Evidence present - Collaboration artifacts",
      "category": "Application",
      "archetype": "detect"
    },
    {
      "id": "Q14",
      "text": "Is file artifact and content activity present in collected evidence related to execution lineage?",
      "label": "File: Evidence present - Execution lineage",
      "category": "File",
      "archetype": "detect"
    },
    {
      "id": "Q82",
      "text": "Have investigators confirmed that network session and transport activity in artifact provenance is authentic telemetry?",
      "label": "Network: Telemetry authentic - Artifact provenance",
      "category": "Network",
      "archetype": "validate"
    },
    {
      "id": "Q83",
      "text": "Have investigators confirmed that cloud control-plane and workload activity in message delivery paths is authentic telemetry?",
      "label": "Cloud: Telemetry authentic - Message delivery paths",
      "category": "Cloud",
      "archetype": "validate"
    },
    {
      "id": "Q85",
      "text": "Have investigators confirmed that application request and session activity in authentication pathways is authentic telemetry?",
      "label": "Application: Telemetry authentic - Authentication pathways",
      "category": "Application",
      "archetype": "validate"
    },
    {
      "id": "Q86",
      "text": "Have investigators confirmed that file artifact and content activity in data access traces is authentic telemetry?",
      "label": "File: Telemetry authentic - Data access traces",
      "category": "File",
      "archetype": "validate"
    },
    {
      "id": "Q147",
      "text": "Have corroborating records validated mailbox message and collaboration activity linked to message delivery paths?",
      "label": "Email: Corroborated - Message delivery paths",
      "category": "Email",
      "archetype": "validate"
    },
    {
      "id": "Q148",
      "text": "Have corroborating records validated application request and session activity linked to workload identity context?",
      "label": "Application: Corroborated - Workload identity context",
      "category": "Application",
      "archetype": "validate"
    },
    {
      "id": "Q149",
      "text": "Have corroborating records validated file artifact and content activity linked to authentication pathways?",
      "label": "File: Corroborated - Authentication pathways",
      "category": "File",
      "archetype": "validate"
    },
    {
      "id": "Q150",
      "text": "Was observed identity authentication and privilege activity for control-plane actions validated using independent evidence sources?",
      "label": "Identity: Independent validation - Control-plane actions",
      "category": "Identity",
      "archetype": "validate"
    },
    {
      "id": "Q151",
      "text": "Have investigators confirmed that endpoint execution and persistence activity in api invocation patterns is authentic telemetry?",
      "label": "Host: Telemetry authentic - API invocation patterns",
      "category": "Host",
      "archetype": "validate"
    },
    {
      "id": "Q152",
      "text": "Have investigators confirmed that network session and transport activity in network pivots is authentic telemetry?",
      "label": "Network: Telemetry authentic - Network pivots",
      "category": "Network",
      "archetype": "validate"
    },
    {
      "id": "Q153",
      "text": "Have investigators confirmed that cloud control-plane and workload activity in endpoint state changes is authentic telemetry?",
      "label": "Cloud: Telemetry authentic - Endpoint state changes",
      "category": "Cloud",
      "archetype": "validate"
    },
    {
      "id": "Q154",
      "text": "Have investigators confirmed that mailbox message and collaboration activity in artifact provenance is authentic telemetry?",
      "label": "Email: Telemetry authentic - Artifact provenance",
      "category": "Email",
      "archetype": "validate"
    },
    {
      "id": "Q155",
      "text": "Was observed identity authentication and privilege activity for collaboration artifacts validated using independent evidence sources?",
      "label": "Identity: Independent validation - Collaboration artifacts",
      "category": "Identity",
      "archetype": "validate"
    },
    {
      "id": "Q156",
      "text": "Have investigators confirmed that endpoint execution and persistence activity in message delivery paths is authentic telemetry?",
      "label": "Host: Telemetry authentic - Message delivery paths",
      "category": "Host",
      "archetype": "validate"
    },
    {
      "id": "Q159",
      "text": "Does validated network session and transport activity for collaboration artifacts align with benign activity, policy violation, or malicious behavior?",
      "label": "Network: Behavior alignment - Collaboration artifacts",
      "category": "Network",
      "archetype": "classify"
    },
    {
      "id": "Q161",
      "text": "Does validated mailbox message and collaboration activity for process ancestry align with benign activity, policy violation, or malicious behavior?",
      "label": "Email: Behavior alignment - Process ancestry",
      "category": "Email",
      "archetype": "classify"
    },
    {
      "id": "Q184",
      "text": "Is the classification of file artifact and content activity in execution lineage supported with sufficient confidence?",
      "label": "File: Confidence check - Execution lineage",
      "category": "File",
      "archetype": "classify"
    },
    {
      "id": "Q187",
      "text": "Does validated network session and transport activity for control-plane actions align with benign activity, policy violation, or malicious behavior?",
      "label": "Network: Behavior alignment - Control-plane actions",
      "category": "Network",
      "archetype": "classify"
    },
    {
      "id": "Q188",